<naw xmlns="http://www.naw.org/schema/naw"
     xmlns:xsi="http://www.w3.org/2001/XMLSchema-instance"
     xsi:schemaLocation="http://www.naw.org/schema/naw
                         http://www.naw.org/schema/naw.xsd">
    
    <process name="c">
        <receive from="file-spring:/tmp/x-spring.txt" entryPoint="true">
            <received variable="abcde">
                <expression language="ognl">@java.lang.System@out.println("1" + objects)</expression>

                <send to="file-spring:/tmp/x2-spring.txt" variable="abcde" retriable="false" exchangeVariable="za" />

                <expression language="ognl">@java.lang.System@out.println('2' + exchange)</expression>

                <receive from="file-spring:/tmp/x2-spring.txt" exchangeVariable="za">
                    <received variable="zzzz">
                        <expression language="ognl">@java.lang.System@out.println('3' + exchange)</expression>
                    </received>

                    <timeout duration="PT5S">
                        <expression language="ognl">@java.lang.System@out.println('4' + exchange)</expression>
                    </timeout>
                </receive>
            </received>
        </receive>
    </process>
</naw>
